City,Country,Procedure,Clinic_Name,Address,Phone,Email,Website,Price_USD_Low,Price_USD_High,Currency,Special_Notes,Certifications,Year_Established,Procedures_Per_Year,Success_Rate,Languages,Package_Includes
Athens,Greece,IVF,Embryolab IVF Clinic,"Athens, Greece","+30 210 699 3089",info@embryolab.eu,https://www.embryolab.eu,3500,5500,EUR,"Advanced IVF center, 50% success rate, experienced embryologists","ISO",2003,2000+,50%,"English, Greek, Russian","IVF cycle, medications, monitoring, transfer, pregnancy test"
Bangkok,Thailand,Botox,Bangkok Hospital Medical Center,"2 Soi Soonvijai 7, New Petchburi Rd, Bangkok 10310","+66 2 310 3000",[email protected],https://www.bangkokhospital.com,220,380,USD,"Asia's Top Private Hospital 2025, extensive aesthetic department","JCI",1972,,,"English, Thai, Arabic, Japanese","Procedure, consultation"
Bangkok,Thailand,Botox,Bangkok Skin Plastic Surgery Center,"Bangkok, Thailand","+66 2 252 7889",info@bangkoksurgery.com,https://www.bangkoksurgery.com,300,400,USD,"Minimally invasive cosmetic procedures specialist","JCI, Thai Medical Council",2005,4000+,94%,"English, Thai, Japanese","Botox injection, medical consultation, cooling treatment"
Bangkok,Thailand,Botox,Bumrungrad International Hospital,"33 Sukhumvit 3, Wattana, Bangkok 10110","+66 2 066 8888",info@bumrungrad.com,https://www.bumrungrad.com,250,400,USD,"Premier medical tourism hospital, 1.1M patients annually, 520,000 from 190+ countries","JCI, ISO",1980,1100000,,"English, Thai, Arabic, Chinese, Japanese","Procedure, consultation, follow-up"
Bangkok,Thailand,Botox,Rattinan Clinic,"Bangkok, Thailand","+66 2 255 2641",info@rattinan.com,https://www.rattinan.com,275,375,USD,"Premium aesthetic clinic, celebrity clientele","Thai FDA, ISO 9001",2008,2500+,95%,"English, Thai, Chinese, Arabic","Botox treatment, skin analysis, post-care"
Bangkok,Thailand,Botox,SoWon Clinic,"Bangkok, Thailand","+66 2 651 1111",contact@sowonclinic.com,https://www.sowonclinic.com,280,380,USD,"Authentic FDA-approved Botox from Korea and US","Thai Ministry of Health, FDA",2012,3000+,96%,"English, Thai, Korean","Botox treatment, consultation, aftercare"
Bangkok,Thailand,Botox,V Square Clinic,"Bangkok, Thailand","+66 2 026 5999",info@vsquareclinic.com,https://www.vsquareclinic.com,250,350,USD,"21 branches, free consultations, highly satisfied clients","Thai FDA, Ministry of Health",2010,5000+,95%,"English, Thai, Chinese","Botox injection, consultation, follow-up"
Bangkok,Thailand,Botox,Yanhee International Hospital,"454 Charansanitwong Road, Bang Phlat, Bangkok 10700","+66 2 879 0300",info@yanhee.net,https://www.yanhee.net,200,350,USD,"Famous for cosmetic procedures, 24-hour service","JCI",1984,,,"English, Thai, Arabic, Chinese, Japanese","Procedure, consultation, medications"
Bangkok,Thailand,Brazilian Butt Lift,Bangkok Hospital Plastic Surgery Center,"2 Soi Soonvijai 7, New Petchburi Rd, Bangkok 10310","+66 2 310 3000",[email protected],https://www.bangkokhospital.com,5000,7000,USD,"Asia's Top Hospital, board-certified surgeons","JCI",1972,,,"English, Thai, Arabic","Surgery, hospital stay, medications, follow-up"
Bangkok,Thailand,Brazilian Butt Lift,Phuket Plastic Surgery Institute,"Phuket (Bangkok branch available)","+66 76 233 555",info@ppsi.co.th,https://www.ppsi.co.th,4000,6000,USD,"Specialized plastic surgery center, 20+ years experience","ISAPS",2000,3000+,,"English, Thai, Chinese","Surgery, hospital stay, compression garments, follow-up"
Bangkok,Thailand,Brazilian Butt Lift,Yanhee International Hospital,"454 Charansanitwong Road, Bang Phlat, Bangkok 10700","+66 2 879 0300",info@yanhee.net,https://www.yanhee.net,4500,6500,USD,"Premier destination for BBL, experienced plastic surgeons","JCI",1984,2500+,,"English, Thai, Arabic, Chinese","Surgery, 2-night hospital stay, hotel, transfers, post-op care"
Bangkok,Thailand,Breast Augmentation,Bangkok Hospital Plastic Surgery,"2 Soi Soonvijai 7, New Petchburi Rd, Bangkok 10310","+66 2 310 3000",[email protected],https://www.bangkokhospital.com,4500,6500,USD,"Asia's Top Hospital 2025, comprehensive plastic surgery center","JCI",1972,,,"English, Thai, Arabic, Japanese","Surgery, hospital stay, implants, post-op care"
Bangkok,Thailand,Breast Augmentation,Bangkok Hospital,"Bangkok, Thailand","+66 2 310 3000",info@bangkokhospital.com,https://www.bangkokhospital.com,4500,6500,USD,"JCI-accredited, internationally recognized","JCI, Thai Hospital Accreditation",1972,500+,96%,"English, Thai, Japanese, Arabic, Chinese","Surgery, implants, hospital stay, post-op care, warranty"
Bangkok,Thailand,Breast Augmentation,Bumrungrad International Hospital,"33 Sukhumvit 3, Wattana, Bangkok 10110","+66 2 066 8888",info@bumrungrad.com,https://www.bumrungrad.com,4800,7000,USD,"Premier medical tourism destination, 1.1M patients annually","JCI, ISO",1980,1100000,,"English, Thai, Arabic, Chinese","Surgery, hospital stay, implants, medications, follow-up"
Bangkok,Thailand,Breast Augmentation,Yanhee International Hospital,"454 Charansanitwong Road, Bang Phlat, Bangkok 10700","+66 2 879 0300",info@yanhee.net,https://www.yanhee.net,4200,6000,USD,"World-renowned for cosmetic procedures, serves 160+ countries","JCI",1984,4000+,,"English, Thai, Arabic, Chinese, Japanese","Surgery, 1-night hospital stay, implants, hotel, transfers"
Bangkok,Thailand,Colonoscopy,Bangkok Hospital Gastroenterology Center,"2 Soi Soonvijai 7, New Petchburi Rd, Bangkok 10310","+66 2 310 3000",[email protected],https://www.bangkokhospital.com,700,1100,USD,"Advanced endoscopy suite, comprehensive GI services","JCI",1972,,,"English, Thai, Arabic","Procedure, sedation, consultation, pathology"
Bangkok,Thailand,Colonoscopy,Bumrungrad International Hospital,"33 Sukhumvit 3, Wattana, Bangkok 10110","+66 2 066 8888",info@bumrungrad.com,https://www.bumrungrad.com,800,1200,USD,"State-of-the-art endoscopy center, experienced gastroenterologists","JCI, ISO",1980,1100000,,"English, Thai, Arabic, Chinese","Procedure, sedation, biopsy if needed, consultation, report"
Bangkok,Thailand,Colonoscopy,Samitivej Sukhumvit Hospital,"133 Sukhumvit 49, Vadhana, Bangkok 10110","+66 2 711 8000",info@samitivej.co.th,https://www.samitivej.co.th,750,1150,USD,"Premier international hospital, advanced endoscopy center","JCI",1979,,,"English, Thai, Japanese","Procedure, anesthesia, consultation, results"
Bangkok,Thailand,Dental Implant,About Tooth Dental Clinic - Siam,"8th Floor SIAMSCAPE, Siam Square 1, Pathum Wan, Bangkok 10330","+6687-555-4665",,https://www.abouttoothdental.com,900,1500,USD,"2 convenient locations (Siam & Punnawithi), Daily 10:30 AM - 8:30 PM",,,,,"English, Thai","Procedure, consultation"
Bangkok,Thailand,Dental Implant,BFC Dental Clinic - Bangna,"347 Bangna-Trad Road, Bangkok 10260","02-396-1075",contact@bfcdental.com,https://www.bfcdental.com,900,1500,USD,"In-house dental lab for faster treatment, multiple Bangkok locations",JCI,1994,4600+,,"English, Thai","Procedure, consultation, X-rays"
Bangkok,Thailand,Dental Implant,Bangkok Dental Spa,"Bangkok, Thailand","+66 2 255 3456",info@bangkokdentalspa.com,https://www.bangkokdentalspa.com,900,1200,USD,"Luxury dental spa, advanced implantology","Thai Dental Council, ISO",2010,2000+,98%,"English, Thai, Japanese, Chinese","Implant, crown, consultations, X-rays, 10-year warranty"
Bangkok,Thailand,Dental Implant,Bangkok International Dental Center (BIDC),"157,159 Ratchadaphisek Rd Soi 7, Ding Daeng, Bangkok 10400","+66 (2) 692 4433",contact@bangkokdentalcenter.com,https://bangkokdentalcenter.com,900,1500,USD,"First JCI-accredited dental center in Thailand, near MRT Cultural Center station",JCI,,,,"English, Thai, Arabic, Chinese","Procedure, consultation, medications"
Bangkok,Thailand,Dental Implant,Bangkok International Dental Hospital (BIDH),"98 Sukhumvit Soi 2, Khlong Toei, Bangkok 10110","+66 2-115-8977",contact@dentalhospitalthailand.com,https://dentalhospitalthailand.com,1500,2000,USD,"98% success rate, 40 certified dentists, 5 Bangkok locations, Carl Zeiss microscopes, 3D CT scans","JCI, ISO",2004,,98%,"English, Thai","Procedure, facility fee, follow-up"
Bangkok,Thailand,Dental Implant,SmileBox Dental Clinic - Thonglor,"1223 Sukhumvit Road, Watthana, Bangkok 10110","094 975 9666",,https://smileboxclinic.com,900,1500,USD,"VR therapy for stress relief, Invisalign Platinum provider, 2 locations","Sha Plus+",2021,,,"English, Thai","Procedure, 3D X-rays, treatment plan"
Bangkok,Thailand,Dental Implant,Thantakit Dental Center,"Bangkok, Thailand","+66 2 252 8989",info@thantakit.com,https://www.thantakit.com,850,1150,USD,"Internationally trained dentists, modern facility","ADA approved, Thai Dental Council",2009,2500+,97%,"English, Thai, Arabic","Straumann implant, abutment, crown, follow-up care"
Bangkok,Thailand,Dental Veneers,Bangkok International Dental Center (BIDC),"157,159 Ratchadaphisek Rd Soi 7, Ding Daeng, Bangkok 10400","+66 (2) 692 4433",contact@bangkokdentalcenter.com,https://bangkokdentalcenter.com,4500,7500,USD,"First JCI-accredited dental center, Hollywood Smile packages, E.Max & Zirconium",JCI,1996,,,"English, Thai, Arabic, Chinese","Full mouth veneers (16-20), consultation, temporary veneers, X-rays"
Bangkok,Thailand,Dental Veneers,SmileBox Dental Clinic,"1223 Sukhumvit Road, Watthana, Bangkok 10110","094 975 9666",info@smileboxclinic.com,https://smileboxclinic.com,4200,7000,USD,"VR therapy for stress relief, digital smile design, 2 locations","Sha Plus+",2021,,,"English, Thai, Chinese","Veneers (full mouth), 3D design, temporaries, X-rays"
Bangkok,Thailand,Dental Veneers,Thantakit Dental Center,"Thonglor, Bangkok","+66 2 258 1558",info@thantakit.com,https://www.thantakit.com,5000,8000,USD,"Specialized in cosmetic dentistry, German technology","ISO 9001",2004,5000+,,"English, Thai","Full mouth veneers, digital smile design, temporaries, follow-up"
Bangkok,Thailand,Facelift,Bangkok Hospital Plastic Surgery,"2 Soi Soonvijai 7, New Petchburi Rd, Bangkok 10310","+66 2 310 3000",[email protected],https://www.bangkokhospital.com,6000,9000,USD,"Asia's Top Hospital, board-certified facial plastic surgeons","JCI",1972,,,"English, Thai, Arabic","Surgery, hospital stay, medications, post-op care, follow-up"
Bangkok,Thailand,Facelift,Yanhee International Hospital,"454 Charansanitwong Road, Bang Phlat, Bangkok 10700","+66 2 879 0300",info@yanhee.net,https://www.yanhee.net,5500,8500,USD,"World-renowned for facial procedures, 24-hour care, serves 160+ countries","JCI",1984,3000+,,"English, Thai, Arabic, Chinese, Japanese, Russian","Surgery, 2-night hospital stay, hotel, medications, follow-up"
Bangkok,Thailand,Gastric Bypass,Bangkok Hospital Phuket,"Phuket, Thailand","+66 76 254 425",info@phukethospital.com,https://www.phukethospital.com,12000,16000,USD,"Bariatric surgery center of excellence","JCI, Thai Bariatric Surgery Society",1994,200+,95%,"English, Thai, Russian, Chinese","Surgery, 5-night stay, nutritionist, lifetime support"
Bangkok,Thailand,Gastric Bypass,Bangkok Hospital Weight Loss Surgery Center,"2 Soi Soonvijai 7, New Petchburi Rd, Bangkok 10310","+66 2 310 3000",[email protected],https://www.bangkokhospital.com,11000,15000,USD,"Comprehensive bariatric program, experienced surgeons, nutritional support","JCI",1972,800+,,"English, Thai, Arabic","Surgery, hospital stay, nutritionist, psychological support, follow-up"
Bangkok,Thailand,Gastric Bypass,Bumrungrad International Hospital,"33 Sukhumvit 3, Wattana, Bangkok 10110","+66 2 066 8888",info@bumrungrad.com,https://www.bumrungrad.com,12000,16000,USD,"Premier bariatric surgery center, laparoscopic specialists, 1.1M patients annually","JCI, ISO",1980,1100000,,"English, Thai, Arabic, Chinese","Surgery, 3-night hospital stay, dietitian, follow-up program"
Bangkok,Thailand,Gastric Bypass,Samitivej Sukhumvit Hospital,"133 Sukhumvit 49, Vadhana, Bangkok 10110","+66 2 711 8000",info@samitivej.co.th,https://www.samitivej.co.th,10500,14500,USD,"JCI-accredited bariatric center, multidisciplinary approach","JCI",1979,600+,,"English, Thai, Japanese","Surgery, 2-3 night stay, dietitian, exercise program, follow-up"
Bangkok,Thailand,Hair Transplant,Bangkok Hair Clinic,"Sukhumvit, Bangkok","+66 2 260 7555",info@bangkokhairclinic.com,https://www.bangkokhairclinic.com,1800,3000,USD,"Specialized hair restoration center, FUE & DHI techniques",,2010,3500+,,"English, Thai","3000 grafts, consultation, medications, aftercare kit"
Bangkok,Thailand,Hair Transplant,Yanhee International Hospital,"454 Charansanitwong Road, Bang Phlat, Bangkok 10700","+66 2 879 0300",info@yanhee.net,https://www.yanhee.net,2200,3500,USD,"FUE & FUT methods, experienced surgeons, 3000+ grafts typical","JCI",1984,2000+,,"English, Thai, Arabic, Chinese, Japanese","Surgery (3000 grafts), hotel, medications, PRP treatment, follow-up"
Bangkok,Thailand,Hip Replacement,Bangkok Hospital Orthopedic Center,"2 Soi Soonvijai 7, New Petchburi Rd, Bangkok 10310","+66 2 310 3000",[email protected],https://www.bangkokhospital.com,11000,15000,USD,"Asia's Top Hospital, comprehensive orthopedic department, experienced surgeons","JCI",1972,800+,,"English, Thai, Arabic","Surgery, hospital stay, implant, rehabilitation, follow-up"
Bangkok,Thailand,Hip Replacement,Bumrungrad International Hospital,"33 Sukhumvit 3, Wattana, Bangkok 10110","+66 2 066 8888",info@bumrungrad.com,https://www.bumrungrad.com,12000,16000,USD,"Premier orthopedic center, 1.1M patients annually, robotic-assisted surgery available","JCI, ISO",1980,1100000,95%,"English, Thai, Arabic, Chinese, Japanese","Surgery, 4-5 night hospital stay, implant, physical therapy, medications"
Bangkok,Thailand,Hip Replacement,Samitivej Hospital,"Bangkok, Thailand","+66 2 022 2222",info@samitivej.co.th,https://www.samitivej.co.th,15000,20000,USD,"Orthopedic center of excellence","JCI, Thai Hospital Accreditation",1979,500+,97%,"English, Thai, Japanese, Arabic","Surgery, implant, 7-night stay, physiotherapy, follow-up"
Bangkok,Thailand,Hip Replacement,Samitivej Sukhumvit Hospital,"133 Sukhumvit 49, Vadhana, Bangkok 10110","+66 2 711 8000",info@samitivej.co.th,https://www.samitivej.co.th,10500,14500,USD,"JCI-accredited orthopedic center, minimally invasive techniques","JCI",1979,600+,,"English, Thai, Japanese","Surgery, 4-night stay, implant, physiotherapy, medications"
Bangkok,Thailand,IVF,Bangkok Hospital IVF Center,"2 Soi Soonvijai 7, New Petchburi Rd, Bangkok 10310","+66 2 310 3000",[email protected],https://www.bangkokhospital.com,4800,7200,USD,"Asia's Top Hospital, advanced reproductive medicine, 42% success rate","JCI",1972,4000+,42%,"English, Thai, Arabic","IVF cycle, medications, ultrasounds, transfer, pregnancy test"
Bangkok,Thailand,IVF,Jetanin Institute,"Bangkok, Thailand","+66 2 253 7777",info@jetanin.com,https://www.jetanin.com,4500,7000,USD,"Thailand's first IVF center, 30+ years experience, 40% success rate","ISO 9001",1990,5000+,40%,"English, Thai, Chinese, Japanese","IVF cycle, medications, consultations, embryo transfer, pregnancy test"
Bangkok,Thailand,IVF,Samitivej Sukhumvit Hospital,"133 Sukhumvit 49, Vadhana, Bangkok 10110","+66 2 711 8000",info@samitivej.co.th,https://www.samitivej.co.th,5000,7500,USD,"JCI-accredited IVF center, comprehensive fertility services, 45% success rate","JCI",1979,3000+,45%,"English, Thai, Japanese","IVF cycle, medications, monitoring, transfer, follow-up"
Bangkok,Thailand,IVF,Superior A.R.T.,"Bangkok, Thailand","+66 2 651 5846",info@superiorart.com,https://www.superiorart.com,4500,7000,USD,"Leading fertility center, 45% success rate","Thai Medical Council",2010,2000+,45%,"English, Thai, Chinese","IVF cycle, medications, monitoring, transfer, pregnancy test"
Bangkok,Thailand,Knee Replacement,BNH Hospital,"Bangkok, Thailand","+66 2 686 2700",info@bnhhospital.com,https://www.bnhhospital.com,14000,18000,USD,"International hospital, 125+ years","JCI accredited",1898,400+,96%,"English, Thai, Japanese, Arabic, French","Total knee replacement, rehab, 10-night stay, PT sessions"
Bangkok,Thailand,Knee Replacement,Bangkok Hospital Orthopedic Center,"2 Soi Soonvijai 7, New Petchburi Rd, Bangkok 10310","+66 2 310 3000",[email protected],https://www.bangkokhospital.com,10000,14000,USD,"Asia's Top Hospital, experienced knee surgeons, modern techniques","JCI",1972,900+,,"English, Thai, Arabic","Surgery, hospital stay, implant, rehabilitation program, follow-up"
Bangkok,Thailand,Knee Replacement,Bumrungrad International Hospital,"33 Sukhumvit 3, Wattana, Bangkok 10110","+66 2 066 8888",info@bumrungrad.com,https://www.bumrungrad.com,11000,15000,USD,"Premier orthopedic center, robotic-assisted surgery, comprehensive rehabilitation","JCI, ISO",1980,1100000,96%,"English, Thai, Arabic, Chinese, Japanese","Surgery, 4-5 night hospital stay, implant, physical therapy, medications"
Bangkok,Thailand,Knee Replacement,Samitivej Sukhumvit Hospital,"133 Sukhumvit 49, Vadhana, Bangkok 10110","+66 2 711 8000",info@samitivej.co.th,https://www.samitivej.co.th,9500,13500,USD,"JCI-accredited, minimally invasive techniques, comprehensive care","JCI",1979,700+,,"English, Thai, Japanese","Surgery, 4-night stay, implant, physiotherapy, medications"
Bangkok,Thailand,LASIK,Bangkok Hospital Eye & LASIK Center,"2 Soi Soonvijai 7, New Petchburi Rd, Bangkok 10310","+66 2755 1307",[email protected],https://www.bangkokhospital.com,1500,2000,USD,"Asia's Top Private Hospital 2025 (Newsweek), ReLEx SMILE, FemtoLASIK, ICL available","JCI, Newsweek Top Hospital",,,,"English, Thai, Arabic, Japanese","Surgery, 6-month follow-up (5 visits), medications"
Bangkok,Thailand,LASIK,Praram 9 Hospital,"99 Rama IX Rd, Huai Khwang, Bangkok 10310",,,https://www.praram9.com,1500,2000,USD,"State-of-the-art equipment, premier medical facility","JCI",,,,"English, Thai","Surgery, consultation, medications"
Bangkok,Thailand,LASIK,Rutnin Eye Hospital,"80/1 Sukhumvit 21 Road (Asoke), Vadhana, Bangkok 10110","+66 2056 3333",contact@rutnin.com,https://www.rutnin.com,1500,2000,USD,"Leading ophthalmology center in Asia, 24-hour operation, 250m from MRT Petchaburi",,,,,"English, Thai","Surgery, consultation, medications, follow-up"
Bangkok,Thailand,LASIK,TRSC International LASIK Center,"6th Floor No. 968 U Chu Liang Building, Rama IV Road, Silom, Bang Rak, Bangkok 10500","+662 632 4500",,https://www.trsclasik.com,1500,2000,USD,"Dr. Ekktet Chansue - first LASIK in Southeast Asia (1994), 2 locations (Rama 4 & Megabangna)",,1994,100000+,,"English, Thai","Surgery, pre-op consultation, 6-month follow-up"
Bangkok,Thailand,LASIK,Yanhee International Hospital,"454 Charansanitwong Road, Bang-O, Bang Phlat, Bangkok 10700","+66 2 879 0300",info@yanhee.net,https://www.yanhee.net,1730,1890,USD,"24-hour service, serves 160+ countries, SBK LASIK & FEMTO LASIK","JCI",,,,"English, Arabic, Chinese, Japanese, Russian","Surgery, consultation, 1-week follow-up"
Bangkok,Thailand,Liposuction,Bangkok Hospital Plastic Surgery,"2 Soi Soonvijai 7, New Petchburi Rd, Bangkok 10310","+66 2 310 3000",[email protected],https://www.bangkokhospital.com,3000,5000,USD,"Asia's Top Hospital, advanced body contouring techniques","JCI",1972,3000+,,"English, Thai, Arabic","Surgery, hospital stay, garments, medications, follow-up"
Bangkok,Thailand,Liposuction,Phuket Plastic Surgery Institute,"Phuket (Bangkok branch)","+66 76 233 555",info@ppsi.co.th,https://www.ppsi.co.th,2200,4000,USD,"Specialized in body contouring, 20+ years experience","ISAPS",2000,4000+,,"English, Thai, Chinese","Surgery, hospital stay, compression garments, follow-up"
Bangkok,Thailand,Liposuction,Yanhee International Hospital,"454 Charansanitwong Road, Bang Phlat, Bangkok 10700","+66 2 879 0300",info@yanhee.net,https://www.yanhee.net,2500,4500,USD,"World-renowned for body contouring, VASER & traditional lipo, 24-hour care","JCI",1984,5000+,,"English, Thai, Arabic, Chinese, Japanese, Russian","Surgery, 1-night hospital stay, compression garments, hotel, medications"
Bangkok,Thailand,Rhinoplasty,Yanhee International Hospital,"454 Charansanitwong Road, Bang Phlat, Bangkok 10700","+66 2 879 0300",info@yanhee.net,https://www.yanhee.net,3500,5500,USD,"World-renowned for facial procedures, serves 160+ countries","JCI",1984,2000+,,"English, Thai, Arabic, Chinese, Japanese","Surgery, 1-night hospital stay, hotel, medications, follow-up"
Bangkok,Thailand,Tummy Tuck,Bangkok Hospital Plastic Surgery,"2 Soi Soonvijai 7, New Petchburi Rd, Bangkok 10310","+66 2 310 3000",[email protected],https://www.bangkokhospital.com,4500,7000,USD,"Asia's Top Hospital, experienced abdominoplasty surgeons","JCI",1972,2000+,,"English, Thai, Arabic","Surgery, hospital stay, garments, post-op care"
Bangkok,Thailand,Tummy Tuck,Bumrungrad International,"Bangkok, Thailand","+66 2 066 8888",info@bumrungrad.com,https://www.bumrungrad.com,5000,7500,USD,"World-renowned hospital, US standards","JCI, Thai Hospital Accreditation",1980,400+,97%,"English, Thai, Arabic, Japanese, 20+ languages","Abdominoplasty, 3-night stay, post-op garment, physiotherapy"
Bangkok,Thailand,Tummy Tuck,Phuket Plastic Surgery Institute,"Phuket (Bangkok branch)","+66 76 233 555",info@ppsi.co.th,https://www.ppsi.co.th,3800,6000,USD,"Body contouring specialists, 20+ years experience","ISAPS",2000,2500+,,"English, Thai, Chinese","Surgery, hospital stay, compression garments, follow-up"
Bangkok,Thailand,Tummy Tuck,Yanhee International Hospital,"454 Charansanitwong Road, Bang Phlat, Bangkok 10700","+66 2 879 0300",info@yanhee.net,https://www.yanhee.net,4000,6500,USD,"World-renowned for body contouring, 24-hour care, comprehensive packages","JCI",1984,3000+,,"English, Thai, Arabic, Chinese, Japanese, Russian","Surgery, 2-night hospital stay, hotel, compression garments, medications"
Bodrum,Turkey,Dental Implant,Comfort Zone Dent,"Bodrum, Muğla, Turkey","+90 252 909 8500",info@comfortzonedent.com,https://www.comfortzonedent.com,600,900,USD,"Luxury dental clinic in Turkey's #1 resort, lifetime guarantee","Turkish Dental Association, Ministry of Health",2020,1500+,98%,"English, Turkish, Arabic, Russian, German","Implant, crown, X-rays, panoramic scan, 3D tomography, lifetime warranty"
Bodrum,Turkey,Dental Implant,Comfort Zone Dent,"Bodrum, Turkey","+905365780999",,https://www.comfortzonedent.com,800,1400,USD,"Lifetime guarantee on implants, 3-day treatment completion, free panoramic X-rays & 3D tomography",,,,,"English, Turkish","Implant, X-rays, 3D scan, consultation, 4-night stay minimum"
Bodrum,Turkey,Dental Veneers,Comfort Zone Dent,"Bodrum, Muğla, Turkey","+90 252 909 8500",info@comfortzonedent.com,https://www.comfortzonedent.com,350,550,USD,"E.Max and Zirconium veneers, 48-hour express service available","Turkish Dental Association, Ministry of Health",2020,2000+,99%,"English, Turkish, Arabic, Russian, German","Veneers, smile design, X-rays, 3-year protection, complimentary consultations"
Bodrum,Turkey,Dental Veneers,Comfort Zone Dent,"Bodrum, Turkey","+905365780999",,https://www.comfortzonedent.com,3500,5500,USD,"E.Max & Zirconium options, Hollywood Smile packages (10 upper/10 lower), 48-hour express service available, 3-10 year guarantees",,,,,"English, Turkish","Veneers, X-rays, smile design, consultation, 4-night minimum stay"
Bogota,Colombia,Brazilian Butt Lift,Hospital Universitario Mayor,"Bogota, Colombia","+57 1 745 9191",info@hospitalmayormed.com,https://www.hospitalmayormed.com,3500,5000,USD,"University teaching hospital, experienced plastic surgery department","Colombian Ministry of Health",1998,3500+,,"English, Spanish","Surgery, hospital stay, medications, follow-up"
Bogota,Colombia,IVF,INSER Bogota,"Bogota, Colombia","+57 1 603 4000",info@inser.com.co,https://www.inser.com.co,3500,5500,USD,"Colombia's leading fertility center, 45% success rate, research-based","Colombian Society of Reproductive Medicine",1995,3500+,45%,"English, Spanish","IVF cycle, medications, scans, embryo transfer, counseling"
Bogota,Colombia,Liposuction,Hospital Universitario Mayor,"Bogota, Colombia","+57 1 745 9191",info@hospitalmayormed.com,https://www.hospitalmayormed.com,1800,3500,USD,"University hospital, experienced plastic surgery department","Colombian Ministry of Health",1998,4000+,,"English, Spanish","Surgery, hospital stay, medications, follow-up"
Bogota,Colombia,Rhinoplasty,Hospital Universitario Mayor,"Bogota, Colombia","+57 1 745 9191",info@hospitalmayormed.com,https://www.hospitalmayormed.com,3200,5000,USD,"University hospital, experienced rhinoplasty surgeons","Colombian Ministry of Health",1998,800+,,"English, Spanish","Surgery, hospital stay, medications, follow-up"
Bogota,Colombia,Tummy Tuck,Hospital Universitario Mayor,"Bogota, Colombia","+57 1 745 9191",info@hospitalmayormed.com,https://www.hospitalmayormed.com,3200,5000,USD,"University hospital, comprehensive plastic surgery department","Colombian Ministry of Health",1998,2500+,,"English, Spanish","Surgery, hospital stay, medications, follow-up"
Budapest,Hungary,Dental Veneers,Swiss Dent Budapest,"Budapest, Hungary","+36 1 950 7070",info@swissdent.hu,https://www.swissdent.hu,3000,5000,EUR,"German & Swiss trained dentists, premium materials, 5-year warranty","ISO 9001",2001,4000+,,"English, German, Hungarian","Full mouth veneers, smile design, accommodation assistance"
Cancun,Mexico,Brazilian Butt Lift,Costamed Medical Group,"Cancun, Quintana Roo","+52 998 881 3400",info@costamed.com,https://www.costamed.com,4500,6500,USD,"JCI-accredited, medical tourism leader","JCI, COFEPRIS",2005,8000+,,"English, Spanish","Surgery, hospital stay, hotel, transfers, post-op care"
Cancun,Mexico,Breast Augmentation,Hospital Galenia,"Cancun, Quintana Roo","+52 998 891 5200",info@galenia.com,https://www.galenia.com,4000,5800,USD,"Medical tourism leader, beachfront location, recovery packages","JCI",2006,5000+,,"English, Spanish","Surgery, hospital stay, implants, hotel, beach recovery"
