City,Country,Procedure,Clinic_Name,Address,Phone,Email,Website,Price_USD_Low,Price_USD_High,Currency,Special_Notes,Certifications,Year_Established,Procedures_Per_Year,Success_Rate,Languages,Package_Includes
Kuala Lumpur,Malaysia,Hair Transplant,Beverly Wilshire Medical Centre,"Kuala Lumpur, Malaysia","+60 3 2141 1188",info@bwmc.com.my,https://www.bwmc.com.my,2000,3500,USD,"Premium medical center, FUE specialists","MSQH",2008,2000+,,"English, Malay, Chinese","3000 grafts, consultation, medications, follow-up"
Medellin,Colombia,Brazilian Butt Lift,COS Medellin Plastic Surgery,"El Poblado, Medellin","+57 4 444 5555",info@cosmedellin.com,https://www.cosmedellin.com,3800,5500,USD,"Colombia's BBL capital, expert surgeons, recovery villa","Colombian Society of Plastic Surgery",2008,5000+,98%,"English, Spanish, Portuguese","Surgery, recovery villa, hotel, transfers, 24/7 nursing care"
Medellin,Colombia,Facelift,COS Medellin Plastic Surgery,"El Poblado, Medellin","+57 4 444 5555",info@cosmedellin.com,https://www.cosmedellin.com,4500,7500,USD,"Colombia's plastic surgery capital, experienced facial surgeons","Colombian Society of Plastic Surgery",2008,5000+,98%,"English, Spanish, Portuguese","Surgery, recovery villa, nursing care, medications"
Medellin,Colombia,Liposuction,COS Medellin Plastic Surgery,"El Poblado, Medellin","+57 4 444 5555",info@cosmedellin.com,https://www.cosmedellin.com,2000,3800,USD,"Colombia's body contouring capital, VASER & HD lipo","Colombian Society of Plastic Surgery",2008,6000+,98%,"English, Spanish, Portuguese","Surgery, recovery villa, nursing care, garments"
Medellin,Colombia,Rhinoplasty,COS Medellin Plastic Surgery,"El Poblado, Medellin","+57 4 444 5555",info@cosmedellin.com,https://www.cosmedellin.com,3000,4800,USD,"Colombia's plastic surgery hub, ultrasonic rhinoplasty available","Colombian Society of Plastic Surgery",2008,1200+,98%,"English, Spanish, Portuguese","Surgery, recovery villa, medications, follow-up"
Medellin,Colombia,Tummy Tuck,COS Medellin Plastic Surgery,"El Poblado, Medellin","+57 4 444 5555",info@cosmedellin.com,https://www.cosmedellin.com,3500,5500,USD,"Colombia's body contouring capital, experienced surgeons","Colombian Society of Plastic Surgery",2008,4000+,98%,"English, Spanish, Portuguese","Surgery, recovery villa, nursing care, garments"
Mexico City,Mexico,Brazilian Butt Lift,Profiles Beverly Hills,"Mexico City, Mexico","+52 55 5281 4444",info@profilesbeverlyhills.com,https://www.profilesbeverlyhills.com,4800,7000,USD,"Board-certified plastic surgeons, 25+ years experience","American Board of Plastic Surgery",1995,2000+,,"English, Spanish","Surgery, hospital stay, hotel, medications, follow-up"
Mexico City,Mexico,Breast Augmentation,Hospital Angeles Lomas,"Huixquilucan, State of Mexico","+52 55 5246 9000",info@hospitalangeles.com,https://www.hospitalangeles.com,4500,6500,USD,"JCI-accredited, premium private hospital network","JCI",1991,,,"English, Spanish","Surgery, hospital stay, implants, medications, follow-up"
Mexico City,Mexico,Dental Implant,Sani Dental Group Mexico City,"Mexico City, Mexico","+52 55 5207 8670",info@sanidental.mx,https://www.sanidental.com,950,1300,USD,"30+ years experience, US-trained dentists","ADA, Mexican Dental Association",1985,3000+,96%,"English, Spanish","Nobel Biocare implant, crown, CT scan, warranty"
Mexico City,Mexico,Facelift,Profiles Beverly Hills,"Mexico City, Mexico","+52 55 5281 4444",info@profilesbeverlyhills.com,https://www.profilesbeverlyhills.com,5500,9000,USD,"Board-certified plastic surgeons, 25+ years experience, modern techniques","American Board of Plastic Surgery",1995,2000+,,"English, Spanish","Surgery, hospital stay, hotel, medications, follow-up care"
Mexico City,Mexico,Gastric Bypass,Hospital Angeles Lomas,"Huixquilucan, State of Mexico","+52 55 5246 9000",info@hospitalangeles.com,https://www.hospitalangeles.com,8500,12000,USD,"JCI-accredited, comprehensive bariatric program, experienced surgeons","JCI",1991,1200+,,"English, Spanish","Surgery, 2-night hospital stay, nutritionist, follow-up care"
Mexico City,Mexico,Gastric Bypass,Hospital Obesity Control Center,"Mexico City, Mexico","+52 55 5081 8000",info@obesitycontrolcenter.com,https://www.obesitycontrolcenter.com,8500,11000,USD,"Specialized bariatric center, 10,000+ procedures","ASMBS, Mexican Bariatric Society",2007,1000+,96%,"English, Spanish","Gastric bypass, hospital stay, dietitian, support groups"
Mexico City,Mexico,Hip Replacement,Hospital Angeles Lomas,"Huixquilucan, State of Mexico","+52 55 5246 9000",info@hospitalangeles.com,https://www.hospitalangeles.com,10000,14000,USD,"JCI-accredited, comprehensive orthopedic department","JCI",1991,1000+,,"English, Spanish","Surgery, hospital stay, implant, physical therapy, follow-up"
Mexico City,Mexico,IVF,Ingenes Mexico City,"Mexico City, Mexico","+52 55 5063 0900",info@ingenes.com,https://www.ingenes.com,4000,6500,USD,"Latin America's leading IVF network, 40% success rate, guarantee programs","Mexican Fertility Association",2000,5000+,40%,"English, Spanish","IVF cycle, medications, monitoring, transfer, pregnancy test"
Mexico City,Mexico,Knee Replacement,Hospital Angeles Lomas,"Huixquilucan, State of Mexico","+52 55 5246 9000",info@hospitalangeles.com,https://www.hospitalangeles.com,9000,13000,USD,"JCI-accredited, experienced orthopedic surgeons","JCI",1991,1200+,,"English, Spanish","Surgery, hospital stay, implant, physical therapy, follow-up"
Mexico City,Mexico,Liposuction,Hospital Angeles,"Mexico City, Mexico","+52 55 5246 5000",contacto@hospitalangeles.com,https://www.hospitalangeles.com,3000,5000,USD,"Major hospital network, board-certified surgeons","JCI accredited",1991,800+,94%,"English, Spanish","VASER liposuction, anesthesia, compression garment, follow-up"
Mexico City,Mexico,Liposuction,Profiles Beverly Hills,"Mexico City, Mexico","+52 55 5281 4444",info@profilesbeverlyhills.com,https://www.profilesbeverlyhills.com,2800,4800,USD,"Board-certified surgeons, VASER & traditional lipo, 25+ years experience","American Board of Plastic Surgery",1995,3500+,,"English, Spanish","Surgery, hospital stay, hotel, garments, medications"
Mexico City,Mexico,Rhinoplasty,Cirplast Plastic Surgery,"Mexico City, Mexico","+52 55 5277 4444",info@cirplast.com,https://www.cirplast.com,3600,5533,USD,"Specialized plastic surgery center","Asociación Mexicana de Cirugía Plástica, American Society of Plastic Surgeons",2000,500+,,"English, Spanish","Surgery, consultation"
Mexico City,Mexico,Rhinoplasty,Cirplast Plastic Surgery,"Mexico City, Mexico",,,,3600,5533,USD,"Specialized plastic surgery center","Asociación Mexicana de Cirugía Plástica, American Society of Plastic Surgeons",,,,"English, Spanish","Surgery, consultation"
Mexico City,Mexico,Rhinoplasty,Clinica Renueva,"Mexico City, Mexico","+52 55 5294 1111",info@clinicarenueva.com,https://www.clinicarenueva.com,3400,5000,USD,"Luxury facility, personalized attention","Mexican Health Ministry",2008,450+,95%,"English, Spanish","Surgery, luxury recovery room, concierge service, follow-ups"
Mexico City,Mexico,Rhinoplasty,Dr. Alejandro Enriquez,"Mexico City, Mexico","+52 55 5540 1234",contacto@dralejandro.com,https://www.dralejandro.com,3500,5500,USD,"Board-certified plastic surgeon, 20+ years experience","Mexican Board of Plastic Surgery",2000,500+,96%,"English, Spanish","Surgery, pre-op tests, post-op care, 3 follow-ups"
Mexico City,Mexico,Rhinoplasty,Dr. Efrain Arreola Mendoza,"Mexico City, Mexico","+52 55 5566 7788",info@drefrainplastica.com,https://www.drefrainplastica.com,4558,4558,USD,"39 years experience, 200+ procedures annually",,1985,200+,,"English, Spanish","Surgery, 1-day hospital stay, CT scan, 3 nights hotel"
Mexico City,Mexico,Rhinoplasty,Dr. Efrain Arreola Mendoza,"Mexico City, Mexico",,,,4558,4558,USD,"39 years experience, 200+ procedures annually",,,,,"English, Spanish","Surgery, 1-day hospital stay, CT scan, 3 nights hotel"
Mexico City,Mexico,Rhinoplasty,Dr. Jorge Perez,"Mexico City, Mexico","+52 55 5280 9999",drperez@cirugiaestetica.mx,https://www.drjorgeperez.com,3200,4800,USD,"Specialist in ethnic rhinoplasty, natural results","FACS, Mexican Board",2005,600+,97%,"English, Spanish","Surgery, CT imaging, post-op kit, unlimited consultations"
Mexico City,Mexico,Rhinoplasty,Dr. Jose Cortes Clinic,"Mexico City, Mexico","+52 55 5555 1234",info@drjosecortes.com,https://www.drjosecortes.com,5400,7500,USD,"18 years experience, 1,100+ rhinoplasties, ultrasonic rhinoplasty pioneer","Mexican Association of Plastic Surgery",2005,1100+,,"English, Spanish","Surgery, pre-op tests, medications, follow-up consultations"
Mexico City,Mexico,Rhinoplasty,Dr. Jose Cortes Clinic,"Mexico City, Mexico",,,,5400,7500,USD,"18 years experience, 1,100+ rhinoplasties, ultrasonic rhinoplasty pioneer in Mexico","Mexican Association of Plastic Surgery",,,,"English, Spanish","Surgery, pre-op tests, medications, follow-up consultations"
Mexico City,Mexico,Rhinoplasty,Family Hospital,"Mexico City, Mexico",,,,3000,7000,USD,"Affordable rhinoplasty packages, expert surgeons",,,,,"English, Spanish","Surgery, consultation, follow-up"
Mexico City,Mexico,Rhinoplasty,Instituto Medico Laser,"Mexico City, Mexico","+52 55 5536 7000",contacto@iml.com.mx,https://www.iml.com.mx,3600,5200,USD,"Advanced technology, comprehensive care","JCI accredited",2002,700+,94%,"English, Spanish, Portuguese","Rhinoplasty, imaging, medications, 6-month follow-up"
Mexico City,Mexico,Rhinoplasty,Profiles Plastic Surgery,"Mexico City, Mexico","+52 55 5211 5050",info@profilesplasticsurgery.com,https://www.profilesplasticsurgery.com,3800,6000,USD,"International reputation, advanced techniques","ISAPS, Mexican Society of Plastic Surgery",1995,800+,95%,"English, Spanish, French","Rhinoplasty, anesthesia, recovery suite, 1-year follow-up"
Mexico City,Mexico,Rhinoplasty,Top Plastic Surgeons Mexico,"Mexico City, Mexico",,,,3100,3100,USD,"All-inclusive surgery packages with board-certified surgeons","Board Certified",,,,"English, Spanish","Surgery, hotel, transfers, all-inclusive vacation package"
Mexico City,Mexico,Tummy Tuck,Profiles Beverly Hills,"Mexico City, Mexico","+52 55 5281 4444",info@profilesbeverlyhills.com,https://www.profilesbeverlyhills.com,4500,7000,USD,"Board-certified surgeons, 25+ years experience, comprehensive packages","American Board of Plastic Surgery",1995,2000+,,"English, Spanish","Surgery, hospital stay, hotel, garments, medications"
Mumbai,India,Colonoscopy,Lilavati Hospital,"Bandra, Mumbai","+91 22 2640 0000",info@lilavatihospital.com,https://www.lilavatihospital.com,380,680,USD,"Multi-specialty hospital, advanced endoscopy center","NABH",1978,,,"English, Hindi, Marathi","Procedure, anesthesia, pathology, report"
Mumbai,India,Gastric Bypass,Lilavati Hospital,"Bandra, Mumbai","+91 22 2640 0000",info@lilavatihospital.com,https://www.lilavatihospital.com,5000,7500,USD,"Multi-specialty hospital, comprehensive weight loss center","NABH",1978,1200+,,"English, Hindi, Marathi","Surgery, hospital stay, nutritionist, exercise program"
Mumbai,India,Hair Transplant,The Esthetic Clinics,"Multiple Mumbai locations","+91 22 6767 4444",info@theestheticclinics.com,https://www.theestheticclinics.com,1400,2600,USD,"Chain of hair transplant clinics, latest technology",,2011,10000+,,"English, Hindi, Marathi","3000 grafts, consultation, PRP, aftercare"
Mumbai,India,Hip Replacement,Lilavati Hospital,"Bandra, Mumbai","+91 22 2640 0000",info@lilavatihospital.com,https://www.lilavatihospital.com,6500,9500,USD,"Multi-specialty hospital, comprehensive orthopedic department","NABH",1978,2000+,,"English, Hindi, Marathi","Surgery, hospital stay, implant, rehabilitation, follow-up"
Mumbai,India,IVF,Bloom IVF Centre,"Lilavati Hospital Campus, Mumbai","+91 22 2640 2000",info@bloomivf.com,https://www.bloomivf.com,2800,4500,USD,"Premium IVF center, experienced specialists, 48% success rate","ISO",2005,3000+,48%,"English, Hindi, Marathi","IVF cycle, medications, monitoring, transfer, counseling"
Mumbai,India,Knee Replacement,Kokilaben Dhirubhai Ambani Hospital,"Andheri, Mumbai","+91 22 4269 6969",info@kokilabenhospital.com,https://www.kokilabenhospital.com,6000,9000,USD,"Premium hospital, state-of-the-art orthopedic center","NABH, JCI",2009,2500+,,"English, Hindi, Gujarati","Surgery, hospital stay, implant, rehabilitation, follow-up"
New Delhi,India,Colonoscopy,Fortis Hospital,"Vasant Kunj, New Delhi","+91 11 4277 6222",info@fortishealthcare.com,https://www.fortishealthcare.com,400,700,USD,"Leading hospital chain, experienced gastroenterologists","NABH, JCI",1996,,,"English, Hindi","Procedure, sedation, biopsy, consultation"
New Delhi,India,Dental Veneers,Smile Craft Dental Clinic,"South Extension, New Delhi","+91 11 4166 6588",info@smilecraftindia.com,https://www.smilecraftindia.com,2000,4000,USD,"Hollywood Smile specialist, E.Max & Zirconium, international patients","ISO",2010,2000+,,"English, Hindi","Full mouth veneers, smile design, temporaries, follow-up"
New Delhi,India,Gastric Bypass,Max Super Specialty Hospital,"Saket, New Delhi","+91 11 2651 5050",info@maxhealthcare.com,https://www.maxhealthcare.com,5500,8000,USD,"Leading hospital chain, experienced bariatric surgeons","NABH, JCI",2006,1800+,,"English, Hindi","Surgery, 2-night hospital stay, dietitian, follow-up program"
New Delhi,India,Hair Transplant,Eugenix Hair Sciences,"Greater Kailash, New Delhi","+91 11 4954 4786",info@eugenix.in,https://www.eugenix.in,1500,2800,USD,"Specialized hair transplant center, Body Hair Transplant specialists","ABHRS",2006,8000+,,"English, Hindi","3000 grafts, FUE/FUT, consultation, medications"
New Delhi,India,Hip Replacement,Fortis Hospital,"Vasant Kunj, New Delhi","+91 11 4277 6222",info@fortishealthcare.com,https://www.fortishealthcare.com,7000,10000,USD,"Leading hospital chain, experienced orthopedic surgeons, ceramic & metal implants","NABH, JCI",1996,2500+,,"English, Hindi","Surgery, 5-night hospital stay, implant, physical therapy"
New Delhi,India,IVF,Nova IVF Fertility,"Multiple Delhi locations","+91 11 4242 4242",info@novaivffertility.com,https://www.novaivffertility.com,2500,4000,USD,"India's largest IVF chain, 50+ centers, 45% success rate","ISO, NABH",2012,15000+,45%,"English, Hindi","IVF cycle, medications, scans, embryo transfer, pregnancy test"
New Delhi,India,Knee Replacement,Max Super Specialty Hospital,"Saket, New Delhi","+91 11 2651 5050",info@maxhealthcare.com,https://www.maxhealthcare.com,6500,9500,USD,"Leading hospital chain, experienced orthopedic department","NABH, JCI",2006,3000+,,"English, Hindi","Surgery, 5-night hospital stay, implant, physical therapy"
New Delhi,India,Rhinoplasty,Cocoona Centre of Aesthetic Transformation,"Defence Colony, New Delhi","+91 11 4166 3000",info@cocoona.in,https://www.cocoona.in,2500,4500,USD,"Specialized rhinoplasty center, international patients","ISO",2012,600+,,"English, Hindi","Surgery, hospital stay, medications, follow-up"
Nicosia,Cyprus,IVF,North Cyprus IVF,"Nicosia, Cyprus","+90 392 444 0600",info@northcyprusivf.com,https://www.northcyprusivf.com,3200,5200,EUR,"Comprehensive fertility center, donor programs, 45% success rate","TRNC Ministry of Health",2005,3000+,45%,"English, Turkish, Russian","IVF cycle, medications, ultrasounds, embryo transfer, follow-up"
Prague,Czech Republic,Dental Veneers,Prague Dental Center,"Prague 1, Czech Republic","+420 222 230 081",info@praguedentalcenter.com,https://www.praguedentalcenter.com,2800,4800,EUR,"Central location, experienced cosmetic dentists, German quality standards",,2005,3000+,,"English, German, Czech","Veneers, consultation, temporaries, digital planning"
Prague,Czech Republic,IVF,GENNET Prague,"Prague 7, Czech Republic","+420 257 225 511",info@gennet.cz,https://www.gennet.cz,3000,5000,EUR,"Central Europe's leading IVF center, 48% success rate, donor programs","ISO",1997,4000+,48%,"English, German, Czech, Russian","IVF cycle, medications, scans, embryo transfer, follow-up"
Prague,Czech Republic,Tummy Tuck,Prague Aesthetic Center,"Prague 1, Czech Republic","+420 222 230 081",info@pragueaesthetic.com,https://www.pragueaesthetic.com,3500,5500,EUR,"Central Europe's plastic surgery hub, experienced surgeons","ISO",2008,1000+,,"English, German, Czech, Russian","Surgery, hospital stay, hotel assistance, garments"
San Jose,Costa Rica,Facelift,Hospital Clinica Biblica,"San Jose, Costa Rica","+506 2522 1000",info@clinicabiblica.com,https://www.clinicabiblica.com,5000,8000,USD,"JCI-accredited, experienced plastic surgery department, medical tourism leader","JCI",1929,,,"English, Spanish","Surgery, hospital stay, medications, follow-up"
San Jose,Costa Rica,Hip Replacement,Hospital Clinica Biblica,"San Jose, Costa Rica","+506 2522 1000",info@clinicabiblica.com,https://www.clinicabiblica.com,11000,15000,USD,"JCI-accredited, experienced orthopedic surgeons, medical tourism packages","JCI",1929,600+,,"English, Spanish","Surgery, hospital stay, implant, rehabilitation, medications"
San Jose,Costa Rica,Knee Replacement,Hospital CIMA,"San Jose, Costa Rica","+506 2208 1000",info@hospitalsanjose.net,https://www.hospitalsanjose.net,10000,14000,USD,"JCI-accredited, comprehensive orthopedic department","JCI",2000,800+,,"English, Spanish","Surgery, hospital stay, implant, rehabilitation, medications"
San Jose,Costa Rica,Tummy Tuck,Hospital Clinica Biblica,"San Jose, Costa Rica","+506 2522 1000",info@clinicabiblica.com,https://www.clinicabiblica.com,4800,7000,USD,"JCI-accredited, experienced plastic surgeons, medical tourism packages","JCI",1929,1200+,,"English, Spanish","Surgery, hospital stay, medications, follow-up"
Seoul,South Korea,Botox,BK Plastic Surgery Hospital,"Gangnam, Seoul","+82 2 547 5600",info@bkplasticsurgery.com,https://www.bkplasticsurgery.com,160,300,USD,"Specialized in facial procedures, 15+ years experience","JCI, KOPS",2008,5000+,,"English, Korean, Chinese","Procedure, consultation"
Seoul,South Korea,Botox,Banobagi Plastic Surgery,"Seoul, South Korea","+82 2 522 6636",info@banobagi.com,https://www.banobagi.com,200,350,USD,"Korea's most famous aesthetic clinic","Korean FDA, KOPS",2000,10000+,97%,"English, Korean, Chinese, Japanese","Botox 50 units, consultation, ice treatment"
Seoul,South Korea,Botox,ID Hospital,"Gangnam, Seoul","+82 2 3496 9787",info@idhospital.com,https://www.idhospital.com,180,320,USD,"Korea's #1 cosmetic surgery brand, 70,000+ procedures","JCI, KOPS",2004,70000+,97%,"English, Korean, Chinese, Japanese, Russian","Procedure, consultation, translator service"
Seoul,South Korea,Breast Augmentation,BK Plastic Surgery Hospital,"Gangnam, Seoul","+82 2 547 5600",info@bkplasticsurgery.com,https://www.bkplasticsurgery.com,4200,6500,USD,"Specialized plastic surgery hospital, 15+ years experience","JCI, KOPS",2008,5000+,,"English, Korean, Chinese, Japanese","Surgery, hospital stay, implants, translator, follow-up"
Seoul,South Korea,Facelift,ID Hospital,"Gangnam, Seoul","+82 2 3496 9787",info@idhospital.com,https://www.idhospital.com,7000,12000,USD,"Korea's #1 cosmetic brand, mini facelift & full facelift options","JCI, KOPS",2004,70000+,97%,"English, Korean, Chinese, Japanese, Russian","Surgery, hospital stay, translator, medications, follow-up"
Seoul,South Korea,Facelift,JK Plastic Surgery,"Gangnam, Seoul","+82 2 3445 5580",info@jkps.com,https://www.jkps.com,6500,11000,USD,"Specialized in facial contouring, V-line facelift, thread lift","KOPS",2007,5000+,,"English, Korean, Chinese","Surgery, recovery care, medications, follow-up"
Seoul,South Korea,Facelift,JK Plastic Surgery,"Seoul, South Korea","+82 2 3447 5800",info@jkps.com,https://www.jkps.com,8000,12000,USD,"Celebrity clientele, natural-looking results","Korean Society of Plastic Surgery",2005,1000+,97%,"English, Korean, Chinese, Japanese","Facelift, anesthesia, 5-star recovery, 1-year follow-up"
Seoul,South Korea,Liposuction,ID Hospital,"Gangnam, Seoul","+82 2 3496 9787",info@idhospital.com,https://www.idhospital.com,2800,5000,USD,"Korea's #1 cosmetic brand, advanced body contouring","JCI, KOPS",2004,70000+,97%,"English, Korean, Chinese, Japanese","Surgery, hospital stay, translator, garments, follow-up"
Seoul,South Korea,Rhinoplasty,ID Hospital,"Gangnam, Seoul","+82 2 3496 9787",info@idhospital.com,https://www.idhospital.com,4500,7500,USD,"Korea's #1 cosmetic brand, specialized in Asian rhinoplasty","JCI, KOPS",2004,70000+,97%,"English, Korean, Chinese, Japanese, Russian","Surgery, hospital stay, translator, medications, follow-up"
Seoul,South Korea,Rhinoplasty,ID Hospital,"Seoul, South Korea","+82 2 3496 9783",info@idhospital.com,https://www.idhospital.com,5000,8000,USD,"Asia's leading facial contouring hospital","Korean FDA, KOPS",2004,2000+,98%,"English, Korean, Chinese, Japanese, Russian","Rhinoplasty, 3D imaging, recovery suite, 1-year care"
Seoul,South Korea,Rhinoplasty,The Line Plastic Surgery Clinic,"Gangnam, Seoul","+82 2 547 2700",info@thelineps.com,https://www.thelineps.com,4000,7000,USD,"Rhinoplasty specialists, natural results, 3D imaging","KOPS",2010,3000+,,"English, Korean, Chinese","Surgery, recovery care, medications, follow-up"
Seoul,South Korea,Tummy Tuck,ID Hospital,"Gangnam, Seoul","+82 2 3496 9787",info@idhospital.com,https://www.idhospital.com,4500,7000,USD,"Korea's #1 cosmetic brand, advanced body contouring techniques","JCI, KOPS",2004,70000+,97%,"English, Korean, Chinese, Japanese","Surgery, hospital stay, translator, garments, follow-up"
Singapore,Singapore,Botox,Raffles Medical Group,"585 North Bridge Road, Singapore 188770","+65 6311 1111",enquiries@rafflesmedical.com,https://www.rafflesmedicalgroup.com,350,550,USD,"Largest private healthcare provider in Singapore","JCI, ISO",1976,,,"English, Chinese, Malay","Procedure, consultation, follow-up"
Singapore,Singapore,Colonoscopy,Mount Elizabeth Hospital,"3 Mount Elizabeth, Singapore 228510","+65 6731 2218",enquiry@parkwaypantai.com,https://www.mountelizabeth.com.sg,1100,1700,USD,"Premium private hospital, advanced endoscopy technology","JCI",1979,,,"English, Chinese, Malay, Tamil","Procedure, anesthesia, biopsy, consultation"
Singapore,Singapore,Colonoscopy,Raffles Hospital,"585 North Bridge Road, Singapore 188770","+65 6311 1111",enquiries@rafflesmedical.com,https://www.rafflesmedicalgroup.com,1200,1800,USD,"Leading private hospital, comprehensive gastroenterology department","JCI, ISO",1976,,,"English, Chinese, Malay","Procedure, sedation, consultation, detailed report"
Singapore,Singapore,Hair Transplant,The Hair and Laser Clinic,"Singapore, Singapore","+65 6738 9989",enquiry@thehairandlaser.com,https://www.thehairandlaser.com,6000,9000,SGD,"Singapore's leading hair restoration center","Singapore Medical Council",2008,800+,95%,"English, Mandarin, Malay","FUE 2000 grafts, PRP, medications, 1-year follow-up"
Singapore,Singapore,Hip Replacement,Mount Elizabeth Hospital,"3 Mount Elizabeth, Singapore 228510","+65 6731 2218",enquiry@parkwaypantai.com,https://www.mountelizabeth.com.sg,18000,25000,USD,"Premium orthopedic care, experienced surgeons, advanced technology","JCI",1979,1200+,,"English, Chinese, Malay","Surgery, hospital stay, premium implant, rehabilitation program"
Singapore,Singapore,IVF,Thomson Fertility Centre,"Thomson Medical Centre, Singapore","+65 6252 7766",info@thomsonfertility.com,https://www.thomsonfertility.com,8000,12000,USD,"Leading fertility center, 50% success rate, advanced technology","Private Hospital and Medical Clinic License",1987,2500+,50%,"English, Chinese, Malay","IVF cycle, medications, monitoring, embryo transfer, counseling"
Singapore,Singapore,Knee Replacement,Mount Elizabeth Hospital,"3 Mount Elizabeth, Singapore 228510","+65 6731 2218",enquiry@parkwaypantai.com,https://www.mountelizabeth.com.sg,16000,23000,USD,"Premium orthopedic care, experienced surgeons, advanced implants","JCI",1979,1400+,,"English, Chinese, Malay","Surgery, hospital stay, premium implant, rehabilitation program"
Singapore,Singapore,LASIK,Singapore National Eye Centre,"Singapore, Singapore","+65 6227 7255",enquiry@snec.com.sg,https://www.snec.com.sg,3000,4000,SGD,"Leading eye care institution in Asia","JCI, Ministry of Health Singapore",1990,8000+,99%,"English, Mandarin, Malay, Tamil","LASIK surgery, comprehensive eye exam, follow-ups, warranty"
Tijuana,Mexico,Brazilian Butt Lift,Renew Body Contouring,"Tijuana, Baja California","+52 664 634 0923",info@renewbodycontouring.com,https://www.renewbodycontouring.com,4200,6000,USD,"BBL specialists, close to US border, recovery house available","Mexican Board of Plastic Surgery",2010,1500+,,"English, Spanish","Surgery, recovery house, medications, post-op garments"
Tijuana,Mexico,Breast Augmentation,Hospital Mi Doctor,"Tijuana, Baja California","+52 664 633 7800",info@hospitalmidoctor.com,https://www.hospitalmidoctor.com,3800,5500,USD,"Close to US border, experienced surgeons, recovery facilities","Mexican Board of Plastic Surgery",2000,3000+,,"English, Spanish","Surgery, hospital stay, implants, medications, recovery house"
Tijuana,Mexico,Dental Veneers,BioDental Care,"Tijuana, Baja California","+52 664 634 3985",info@biodentalcare.com,https://www.biodentalcare.com,3200,5500,USD,"Close to US border, premium materials, same-day service available","ADA",2005,3000+,,"English, Spanish","Full mouth veneers, consultation, temporaries, X-rays"
Tijuana,Mexico,Gastric Bypass,Obesity Control Center,"Tijuana, Baja California","+1 866 376 7849",info@obesitycontrolcenter.com,https://www.obesitycontrolcenter.com,7500,10500,USD,"Bariatric surgery specialists, close to US border, comprehensive aftercare","Mexican Board of Surgery",2008,3500+,98%,"English, Spanish","Surgery, hospital stay, hotel, nutritionist, lifetime support"
