City,Country,Procedure,Clinic_Name,Address,Phone,Email,Website,Price_USD_Low,Price_USD_High,Currency,Special_Notes,Certifications,Year_Established,Procedures_Per_Year,Success_Rate,Languages,Package_Includes
Cancun,Mexico,Dental Veneers,Cancun Dental Design,"Cancun, Quintana Roo","+52 998 883 3003",info@cancundentaldesign.com,https://www.cancundentaldesign.com,3500,6000,USD,"Beachfront location, vacation + dental packages, E.Max specialists",,2008,2500+,,"English, Spanish","Veneers, digital smile design, hotel, transfers, follow-up"
Cancun,Mexico,Gastric Bypass,Costamed Medical Group,"Cancun, Quintana Roo","+52 998 881 3400",info@costamed.com,https://www.costamed.com,8000,11500,USD,"JCI-accredited, bariatric tourism packages, beachfront recovery","JCI, COFEPRIS",2005,1000+,,"English, Spanish","Surgery, hospital stay, hotel, nutritionist, beach recovery"
Cancun,Mexico,IVF,Cancun Fertility Center,"Cancun, Quintana Roo","+52 998 253 2835",info@cancunfertility.com,https://www.cancunfertility.com,3800,6000,USD,"Beachfront fertility clinic, vacation + treatment packages, 42% success rate",,2010,1500+,42%,"English, Spanish","IVF cycle, medications, monitoring, transfer, beach recovery"
Cancun,Mexico,Liposuction,Costamed Medical Group,"Cancun, Quintana Roo","+52 998 881 3400",info@costamed.com,https://www.costamed.com,2500,4500,USD,"JCI-accredited, body contouring specialists, beach recovery packages","JCI, COFEPRIS",2005,4000+,,"English, Spanish","Surgery, hospital stay, hotel, transfers, beach recovery"
Cancun,Mexico,Rhinoplasty,Costamed Medical Group,"Cancun, Quintana Roo","+52 998 881 3400",info@costamed.com,https://www.costamed.com,4200,6500,USD,"JCI-accredited, experienced rhinoplasty surgeons, beach recovery","JCI, COFEPRIS",2005,600+,,"English, Spanish","Surgery, hospital stay, hotel, beach recovery"
Cancun,Mexico,Tummy Tuck,Costamed Medical Group,"Cancun, Quintana Roo","+52 998 881 3400",info@costamed.com,https://www.costamed.com,4200,6500,USD,"JCI-accredited, body contouring center, beachfront recovery","JCI, COFEPRIS",2005,2500+,,"English, Spanish","Surgery, hospital stay, hotel, beach recovery, garments"
City,Country,Procedure,Clinic_Name,Address,Phone,Email,Website,Price_USD_Low,Price_USD_High,Currency,Special_Notes,Certifications,Year_Established,Procedures_Per_Year,Success_Rate,Languages,Package_Includes
Dubai,UAE,Botox,American Academy of Cosmetic Surgery Hospital,"Al Barsha, Dubai","+971 4 423 5600",info@aacsh.com,https://www.aacsh.com,280,450,USD,"First JCI-accredited cosmetic surgery hospital in Middle East","JCI, DHA",2005,8000+,,"English, Arabic, French","Procedure, consultation, follow-up"
Dubai,UAE,Botox,Cocoona Centre for Aesthetic Transformation,"Dubai Healthcare City, Dubai","+971 4 388 1313",info@cocoona.ae,https://www.cocoona.ae,300,480,USD,"Award-winning aesthetic center, luxury environment","DHA, ISO",2008,,,"English, Arabic, Russian","Procedure, consultation"
Dubai,UAE,Breast Augmentation,American Academy of Cosmetic Surgery,"Al Barsha, Dubai","+971 4 423 5600",info@aacsh.com,https://www.aacsh.com,6500,9000,USD,"First JCI-accredited cosmetic hospital in Middle East","JCI, DHA",2005,8000+,,"English, Arabic, French, Russian","Surgery, hospital stay, premium implants, luxury recovery"
Dubai,UAE,Colonoscopy,Mediclinic City Hospital,"Dubai Healthcare City, Dubai","+971 4 435 9999",info@mediclinic.ae,https://www.mediclinic.ae,900,1400,USD,"International standard hospital, advanced endoscopy suite","JHA, JCI",2008,,,"English, Arabic, French","Procedure, sedation, consultation, comprehensive report"
Dubai,UAE,Dental Veneers,Dr. Joy Dental Clinic,"Dubai, UAE","+971 4 344 0668",info@drjoydental.ae,https://www.drjoydental.ae,450,650,USD,"Premium cosmetic dentistry, celebrity clients","Dubai Health Authority",2010,1500+,98%,"English, Arabic, Hindi, Urdu","Porcelain veneers per tooth, mock-up, 3 visits, 10-year warranty"
Dubai,UAE,Facelift,Cocoona Centre for Aesthetic Transformation,"Dubai Healthcare City, Dubai","+971 4 388 1313",info@cocoona.ae,https://www.cocoona.ae,8000,14000,USD,"Award-winning luxury aesthetic center, experienced surgeons","DHA, ISO",2008,2000+,,"English, Arabic, Russian, French","Surgery, hospital stay, luxury recovery suite, medications"
Dubai,UAE,Hair Transplant,Bizrahmed Hair Transplant Clinic,"Dubai Healthcare City, Dubai","+971 4 431 2396",info@bizrahmed.com,https://www.bizrahmed.com,3500,5500,USD,"Specialized hair transplant center, FUE & Sapphire FUE","DHA",2012,5000+,,"English, Arabic, Urdu","3000 grafts, consultation, PRP, medications, follow-up"
Dubai,UAE,Hip Replacement,Mediclinic City Hospital,"Dubai Healthcare City, Dubai","+971 4 435 9999",info@mediclinic.ae,https://www.mediclinic.ae,15000,22000,USD,"International standard orthopedic center, experienced surgeons","JHA, JCI",2008,800+,,"English, Arabic, French","Surgery, hospital stay, premium implant, rehabilitation program"
Dubai,UAE,IVF,Fakih IVF Fertility Center,"Dubai, UAE","+971 4 379 6464",info@fakihivf.com,https://www.fakihivf.com,6000,9000,USD,"Award-winning fertility center, 50%+ success rate, advanced technology","DHA, JCI",2003,5000+,52%,"English, Arabic, French","IVF cycle, medications, monitoring, embryo transfer, counseling"
Dubai,UAE,Knee Replacement,American Hospital Dubai,"Oud Metha, Dubai","+971 4 336 7777",info@ahdubai.com,https://www.ahdubai.com,14000,20000,USD,"Established 1996, comprehensive orthopedic center","JCI, JCIA",1996,1000+,,"English, Arabic, French","Surgery, hospital stay, premium implant, rehabilitation program"
Dubai,UAE,LASIK,Moorfields Eye Hospital,"Dubai, UAE","+971 4 429 7888",info@moorfields.ae,https://www.moorfields.ae,2500,3500,USD,"Branch of world-renowned London hospital","JCI, Dubai Health Authority",2007,5000+,99%,"English, Arabic, Hindi","Blade-free LASIK, pre/post-op exams, lifetime enhancement"
Dubai,UAE,Liposuction,Cocoona Centre,"Dubai Healthcare City, Dubai","+971 4 388 1313",info@cocoona.ae,https://www.cocoona.ae,3500,6000,USD,"Award-winning aesthetic center, VASER & laser lipo","DHA, ISO",2008,2500+,,"English, Arabic, Russian","Surgery, hospital stay, luxury recovery, garments"
Dubai,UAE,Rhinoplasty,American Academy of Cosmetic Surgery,"Al Barsha, Dubai","+971 4 423 5600",info@aacsh.com,https://www.aacsh.com,5500,9000,USD,"First JCI-accredited cosmetic hospital in Middle East, experienced surgeons","JCI, DHA",2005,1000+,,"English, Arabic, French","Surgery, hospital stay, luxury recovery, medications"
Dubai,UAE,Tummy Tuck,Cocoona Centre,"Dubai Healthcare City, Dubai","+971 4 388 1313",info@cocoona.ae,https://www.cocoona.ae,5500,8500,USD,"Award-winning aesthetic center, luxury recovery suites","DHA, ISO",2008,1500+,,"English, Arabic, Russian","Surgery, hospital stay, luxury recovery, garments"
Istanbul,Turkey,Botox,American Hospital Istanbul,"Nisantasi, Istanbul","+90 212 444 3777",info@americanhospital.com,https://www.americanhospital.com,200,320,USD,"Established 1920, oldest US-affiliated hospital outside US","JCI",1920,,,"English, Turkish, German","Procedure, consultation"
Istanbul,Turkey,Botox,Estethica Atasehir,"Atasehir, Istanbul","+90 216 570 00 00",info@estethica.com.tr,https://www.estethica.com.tr,150,280,USD,"Largest aesthetic surgery chain in Turkey, 8 locations","ISO 9001",2004,15000+,,"English, Turkish, Arabic, Russian","Procedure, consultation, aftercare"
Istanbul,Turkey,Botox,Memorial Sisli Hospital Aesthetic Clinic,"Sisli, Istanbul","+90 212 314 66 66",info@memorial.com.tr,https://www.memorial.com.tr,180,300,USD,"JCI-accredited, comprehensive aesthetic center",JCI,1995,,,"English, Turkish, Arabic, German","Procedure, consultation"
Istanbul,Turkey,Brazilian Butt Lift,Comfort Zone Surgery,"Göktürk Merkez Mahallesi İstanbul Cd. No:26K D:1, 34075 Eyüpsultan, Istanbul","+90 533 954 70 06",request@comfortzonesurgery.com,https://www.comfortzonesurgery.com,4500,6500,USD,"BBL specialist, 1,800+ procedures/year",,,,1800+,"English, Turkish, Arabic, Russian","Surgery, hospital stay, hotel, airport transfers, post-op care"
Istanbul,Turkey,Brazilian Butt Lift,Comfort Zone Surgery,"Göktürk Merkez Mahallesi İstanbul Cd. No:26K, D:1, 34075 Eyüpsultan/İstanbul","+90 212 909 8500",info@comfortzonesurgery.com,https://www.comfortzonesurgery.com,4500,6500,USD,"Natural body contouring, all-inclusive packages","Turkish Ministry of Health, JCI Partner Hospital",2018,700+,96%,"English, Turkish, Arabic, Russian, German","BBL surgery, hotel, transfers, compression garment, medications"
Istanbul,Turkey,Brazilian Butt Lift,Estethica Aesthetic Surgery,"Atasehir, Istanbul","+90 216 570 00 00",info@estethica.com.tr,https://www.estethica.com.tr,4200,6000,USD,"Turkey's largest aesthetic chain, BBL specialists","ISO 9001",2004,15000+,,"English, Turkish, Arabic, Russian","Surgery, hospital stay, hotel, transfers, post-op garments"
Istanbul,Turkey,Brazilian Butt Lift,Estetik International,"Istanbul, Turkey","+90 212 373 1000",info@estetikinternational.com,https://www.estetikinternational.com,4500,6500,USD,"Turkey's largest aesthetic surgery group","Turkish Ministry of Health, JCI",1999,1500+,96%,"English, Turkish, Arabic, Russian, German","BBL surgery, hotel, transfers, compression garment, follow-up"
Istanbul,Turkey,Brazilian Butt Lift,Memorial Bahcelievler Hospital,"Bahcelievler, Istanbul","+90 212 314 66 66",info@memorial.com.tr,https://www.memorial.com.tr,4500,6500,USD,"JCI-accredited, experienced BBL surgeons",JCI,2014,,,"English, Turkish, Arabic","Surgery, 1-night hospital stay, hotel, transfers"
Istanbul,Turkey,Breast Augmentation,Comfort Zone Surgery,"Göktürk Merkez Mahallesi İstanbul Cd. No:26K D:1, 34075 Eyüpsultan, Istanbul","+90 533 954 70 06",request@comfortzonesurgery.com,https://www.comfortzonesurgery.com,4000,6000,USD,"1,800+ procedures/year, all-inclusive medical tourism packages",,,,1800+,"English, Turkish, Arabic, Russian","Surgery, hospital stay, hotel, airport transfers, post-op care"
Istanbul,Turkey,Breast Augmentation,Comfort Zone Surgery,"Göktürk Merkez Mahallesi İstanbul Cd. No:26K, D:1, 34075 Eyüpsultan/İstanbul","+90 212 909 8500",info@comfortzonesurgery.com,https://www.comfortzonesurgery.com,4000,6000,USD,"Premium implants, all-inclusive care packages","Turkish Ministry of Health, JCI Partner Hospital",2018,800+,96%,"English, Turkish, Arabic, Russian, German","Surgery, implants, hotel, VIP transfers, compression garments"
Istanbul,Turkey,Breast Augmentation,Estethica Surgery,"Atasehir, Istanbul","+90 216 570 00 00",info@estethica.com.tr,https://www.estethica.com.tr,3800,5500,USD,"Turkey's largest aesthetic surgery chain, 8 locations nationwide","ISO 9001",2004,15000+,,"English, Turkish, Arabic, Russian","Surgery, hospital stay, implants, hotel, transfers"
Istanbul,Turkey,Breast Augmentation,Florence Nightingale Hospital,"Istanbul, Turkey","+90 212 224 4950",info@florence.com.tr,https://www.florence.com.tr,4200,6000,USD,"Premium hospital, experienced surgeons","JCI, Turkish Ministry of Health",1989,600+,95%,"English, Turkish, Arabic, German","Surgery, Mentor implants, 2-night stay, follow-ups"
Istanbul,Turkey,Breast Augmentation,Florence Nightingale Hospital,"Sisli, Istanbul","+90 212 224 49 50",info@florence.com.tr,https://www.florence.com.tr,4000,6000,USD,"Premium private hospital, experienced plastic surgeons","JCI",1989,,,"English, Turkish, German","Surgery, hospital stay, implants, medications"
Istanbul,Turkey,Breast Augmentation,Memorial Sisli Hospital,"Sisli, Istanbul","+90 212 314 66 66",info@memorial.com.tr,https://www.memorial.com.tr,3900,5800,USD,"JCI-accredited, comprehensive plastic surgery department",JCI,1995,,,"English, Turkish, Arabic, Russian","Surgery, hospital stay, implants, transfers"
Istanbul,Turkey,Colonoscopy,American Hospital,"Istanbul, Turkey","+90 444 3777",info@americanhospital.com.tr,https://www.americanhospital.com.tr,800,1200,USD,"US-standard medical care in Turkey","JCI accredited",1920,3000+,98%,"English, Turkish, Arabic","Colonoscopy, sedation, biopsy if needed, consultation"
Istanbul,Turkey,Colonoscopy,Memorial Sisli Hospital,"Sisli, Istanbul","+90 212 314 66 66",info@memorial.com.tr,https://www.memorial.com.tr,500,900,USD,"JCI-accredited, comprehensive gastroenterology department",JCI,1995,,,"English, Turkish, Arabic","Procedure, sedation, consultation, pathology report"
Istanbul,Turkey,Dental Implant,Dentakay Clinic,"Istanbul, Turkey","+90 212 909 1500",info@dentakay.com,https://www.dentakay.com,750,1000,USD,"All-on-4 specialists, modern technology","Turkish Dental Association, ISO",2016,2000+,95%,"English, Turkish, Arabic, German","Swiss implant, zirconia crown, panoramic X-ray, 15-year warranty"
Istanbul,Turkey,Dental Veneers,Comfort Zone Dent,"Bodrum & Istanbul locations","+905365780999",info@comfortzonedent.com,https://www.comfortzonedent.com,3500,5500,USD,"E.Max & Zirconium, Hollywood Smile, 48-hour express service, 3-10 year guarantee",,2015,,,"English, Turkish, Arabic","Full mouth veneers, smile design, temporaries, 4-night hotel"
Istanbul,Turkey,Dental Veneers,DentGroup Istanbul,"Multiple Istanbul locations","+90 212 280 6464",info@dentgroupistanbul.com,https://www.dentgroupistanbul.com,3800,6000,USD,"Turkey's largest dental chain, 17 clinics nationwide","ISO 9001",2006,50000+,,"English, Turkish, German, Arabic","Veneers, digital design, temporaries, transfers"
Istanbul,Turkey,Facelift,Comfort Zone Surgery,"Göktürk Merkez Mahallesi İstanbul Cd. No:26K, D:1, 34075 Eyüpsultan/İstanbul","+90 212 909 8500",info@comfortzonesurgery.com,https://www.comfortzonesurgery.com,5000,7500,USD,"Fox Eyes & Cheek Lift specialty, natural-looking results","Turkish Ministry of Health, JCI Partner Hospital",2018,400+,96%,"English, Turkish, Arabic, Russian, German","Facelift surgery, hotel, VIP service, medications, follow-up care"
Istanbul,Turkey,Facelift,Estethica Aesthetic Surgery,"Atasehir, Istanbul","+90 216 570 00 00",info@estethica.com.tr,https://www.estethica.com.tr,4200,6800,USD,"Turkey's largest aesthetic chain, SMAS facelift specialists","ISO 9001",2004,15000+,,"English, Turkish, Arabic, German","Surgery, hospital stay, hotel, post-op care, transfers"
Istanbul,Turkey,Facelift,Memorial Bahcelievler Hospital,"Bahcelievler, Istanbul","+90 212 314 66 66",info@memorial.com.tr,https://www.memorial.com.tr,4500,7000,USD,"JCI-accredited, experienced facial surgeons, modern techniques",JCI,2014,1500+,,"English, Turkish, Arabic, Russian","Surgery, 1-2 night hospital stay, hotel, transfers, medications"
Istanbul,Turkey,Gastric Bypass,Acibadem Maslak Hospital,"Maslak, Istanbul","+90 212 304 44 44",info@acibadem.com.tr,https://www.acibadem.com.tr,7000,10000,USD,"Leading hospital chain, comprehensive bariatric program","JCI, ISO",1991,1500+,,"English, Turkish, German","Surgery, hospital stay, nutritionist, psychological support"
Istanbul,Turkey,Gastric Bypass,Memorial Sisli Hospital,"Sisli, Istanbul","+90 212 314 66 66",info@memorial.com.tr,https://www.memorial.com.tr,6500,9500,USD,"JCI-accredited bariatric center, laparoscopic specialists",JCI,1995,2000+,,"English, Turkish, Arabic, Russian","Surgery, 2-night hospital stay, hotel, dietitian, follow-up"
Istanbul,Turkey,Hair Transplant,ASMED Clinic,"Istanbul, Turkey","+90 212 219 3933",info@asmed.com.tr,https://www.asmed.com.tr,3500,5500,USD,"Dr. Koray Erdogan, manual FUE expert, 90%+ graft survival","ISHRS, ABHRS",1998,1500+,98%,"English, Turkish, German","High-detail FUE, hotel, transfers, detailed post-op plan"
Istanbul,Turkey,Hair Transplant,Clinicana Clinic,"Istanbul",,,,2700,4200,USD,"FUE & Sapphire FUE specialist, known for natural look and excellent results",,,,,"English, Turkish, Arabic","Surgery, hotel, transfers, medications"
Istanbul,Turkey,Hair Transplant,Cosmedica Clinic (Dr. Levent Acar),"Istanbul",,,,4260,4260,EUR,"16 years experience, Micro Sapphire DHI specialist, all-inclusive luxury packages",,,,,"English, Turkish, German","Surgery, 5-star hotel, VIP transfers, aftercare, medications"
Istanbul,Turkey,Hair Transplant,Dr. Serkan Aygin Clinic,"Istanbul",,,,1800,4500,USD,"28 years experience, 25,000+ procedures, DHI & Sapphire FUE & PRP & stem cell treatments",,,,,"English, Turkish, Arabic","All-inclusive package with hotel, transfers"
Istanbul,Turkey,Hair Transplant,Dr. Serkan Aygin Clinic,"Istanbul, Turkey","+90 212 231 3134",info@drserkanaygin.com,https://www.drserkanaygin.com,3000,4500,USD,"25+ years experience, 15,000+ procedures","ISHRS, Turkish Medical Association",1996,2000+,96%,"English, Turkish, Arabic, German, French","FUE transplant, hotel, airport pickup, PRP treatment"
Istanbul,Turkey,Hair Transplant,Estepera Clinic,"Istanbul, Turkey","+90 212 909 2000",contact@estepera.com,https://www.estepera.com,2600,4000,USD,"Modern facility, personalized treatment plans","Turkish Ministry of Health, ISO",2015,3000+,95%,"English, Turkish, Arabic, Spanish","DHI/FUE procedure, accommodation, transfers, aftercare kit"
Istanbul,Turkey,Hair Transplant,Hermest Hair Clinic,"Istanbul, Turkey","+90 212 909 4000",info@hermest.com,https://www.hermest.com,2900,4400,USD,"High surgeon involvement, proven long-term results","Turkish Ministry of Health",2014,2000+,97%,"English, Turkish, Arabic, Dutch","FUE procedure, 3-star hotel, airport service, medications"
Istanbul,Turkey,Hair Transplant,Smile Hair Clinic,"Istanbul",,,,2390,3590,USD,"DHI & Sapphire FUE, 4.9/5 rating on 2,000+ Google reviews",,,,,"English, Turkish, Arabic, German","3,000-5,000 grafts, hotel, transfers"
Istanbul,Turkey,Hair Transplant,Smile Hair Clinic,"Istanbul, Turkey","+90 212 706 1000",info@smilehairclinic.com,https://www.smilehairclinic.com,2500,4000,USD,"TEMOS A-rated, world's first accredited hair transplant clinic","TEMOS International Healthcare",2012,3500+,98%,"English, Turkish, Arabic, German","FUE/DHI procedure, hotel, transfers, first wash"
Istanbul,Turkey,Hair Transplant,Sule Hair Transplant,"Istanbul, Turkey","+90 212 909 3500",info@sulehairtransplant.com,https://www.sulehairtransplant.com,2800,4300,USD,"12+ years, 12,000+ procedures, medical robustness","Turkish Health Ministry",2012,2500+,96%,"English, Turkish, Arabic, Russian, German","FUE/Sapphire, hotel, transfers, lifetime consultation"
Istanbul,Turkey,Hair Transplant,Vera Clinic,"Istanbul, Turkey","+90 212 909 4500",info@veraclinic.net,https://www.veraclinic.net,2700,4200,USD,"Sapphire FUE and DHI specialists","Turkish Ministry of Health",2013,4000+,97%,"English, Turkish, Arabic, Russian","Surgery, 4-star hotel, VIP transfers, medications"
Istanbul,Turkey,Hair Transplant,Vera Clinic,"Kordonboyu, Turgut Özal Blv. No: 47, 34860 Kartal, Istanbul","+90 555 888 81 23",,https://www.veraclinic.net,2000,3000,USD,"30,000+ patients since 2013, FUE/Sapphire FUE/DHI, 11 miles from SAW airport, 25-min drive",,2013,30000+,,"English, French, Spanish, Italian, German, Arabic, Portuguese, Russian","Surgery, hotel (5-star), VIP transfers, medications, aftercare"
Istanbul,Turkey,Hip Replacement,Memorial Sisli Hospital,"Sisli, Istanbul","+90 212 314 66 66",info@memorial.com.tr,https://www.memorial.com.tr,8000,12000,USD,"JCI-accredited orthopedic center, European standard implants",JCI,1995,1500+,,"English, Turkish, Arabic, Russian","Surgery, 5-night hospital stay, implant, physiotherapy, medications"
Istanbul,Turkey,IVF,Acibadem Altunizade Hospital,"Altunizade, Istanbul","+90 216 544 44 44",info@acibadem.com.tr,https://www.acibadem.com.tr,3800,6000,USD,"Leading IVF center, advanced laboratory, 43% success rate","JCI, ISO",2002,3500+,43%,"English, Turkish, Arabic","IVF cycle, medications, monitoring, transfer, pregnancy test"
Istanbul,Turkey,IVF,Bahceci Health Group,"Istanbul, Turkey","+90 212 909 7000",info@bahceci.com,https://www.bahceci.com,3500,5500,USD,"Turkey's largest IVF network, 40% success rate","Turkish Ministry of Health, ESHRE",2004,4000+,40%,"English, Turkish, Arabic, Russian","IVF treatment, medications, ultrasounds, embryo transfer"
Istanbul,Turkey,IVF,Memorial Sisli Hospital IVF Center,"Sisli, Istanbul","+90 212 314 66 66",info@memorial.com.tr,https://www.memorial.com.tr,3500,5500,USD,"JCI-accredited fertility center, 45% success rate, comprehensive services",JCI,1995,4000+,45%,"English, Turkish, Arabic, Russian","IVF cycle, medications, ultrasounds, embryo transfer, follow-up"
Istanbul,Turkey,Knee Replacement,Memorial Bahcelievler Hospital,"Bahcelievler, Istanbul","+90 212 314 66 66",info@memorial.com.tr,https://www.memorial.com.tr,7500,11000,USD,"JCI-accredited, comprehensive orthopedic services, European implants",JCI,2014,1800+,,"English, Turkish, Arabic, Russian","Surgery, 5-night hospital stay, implant, physiotherapy, medications"
Istanbul,Turkey,LASIK,Bati Göz Eye Center,"Multiple locations in Istanbul & Izmir",,,,1350,1575,EUR,"TÜV & ISO certified, Carl ZEISS Center of Excellence","TÜV Rheinland, ISO9001, Carl ZEISS CoE",,,,"English, Turkish, German","Both eyes, consultations"
Istanbul,Turkey,LASIK,Dunyagoz Eye Hospital Istanbul Etiler,"Etiler, Istanbul",,,,1350,1800,EUR,"Private single-specialty ophthalmology center, international patients",,,,,"English, Turkish, Arabic","Surgery, hotel, transfers"
Istanbul,Turkey,LASIK,Kudret Eye Istanbul,"Sarayardı Street No: 3, Acibadem Kadikoy, Istanbul","+90 541 457 50 15",info@kudretgozistanbul.com,https://www.kudretgozistanbul.com,1565,1790,EUR,"TÜV & ISO certified, Carl ZEISS Center of Excellence, Mon-Fri 09:00-18:00, Sat 09:00-13:00","TÜV Rheinland, ISO9001, Carl ZEISS CoE",2005,,,"English, Turkish, Arabic","Both eyes, pre/post-op exams"
Istanbul,Turkey,LASIK,Memorial Şişli Hospital,"Şişli, Istanbul",,,,1690,2250,EUR,"JCI-accredited multidisciplinary center, patients from 92 countries annually",JCI,,,,"English, Turkish, Arabic, Russian","Surgery, consultation, medications"
Istanbul,Turkey,LASIK,VM Hospitals Istanbul,"Istanbul",,,,1350,1800,EUR,"Private multi-specialty medical center",,,,,"English, Turkish","Surgery, consultation"
Istanbul,Turkey,Liposuction,Comfort Zone Surgery,"Göktürk Merkez Mahallesi İstanbul Cd. No:26K, D:1, 34075 Eyüpsultan/İstanbul","+90 212 909 8500",info@comfortzonesurgery.com,https://www.comfortzonesurgery.com,2500,4000,USD,"VASER Lipo and VASER Hi-DEF available, precision sculpting","Turkish Ministry of Health, JCI Partner Hospital",2018,1000+,97%,"English, Turkish, Arabic, Russian, German","VASER liposuction, hotel, transfers, compression garment, aftercare"
Istanbul,Turkey,Liposuction,Estethica Surgery,"Atasehir, Istanbul","+90 216 570 00 00",info@estethica.com.tr,https://www.estethica.com.tr,2000,3800,USD,"Turkey's largest aesthetic chain, VASER lipo specialists","ISO 9001",2004,15000+,,"English, Turkish, Arabic, Russian","Surgery, hospital stay, hotel, garments, transfers"
Istanbul,Turkey,Liposuction,Memorial Sisli Hospital,"Sisli, Istanbul","+90 212 314 66 66",info@memorial.com.tr,https://www.memorial.com.tr,2200,4000,USD,"JCI-accredited, experienced plastic surgeons",JCI,1995,2500+,,"English, Turkish, Arabic","Surgery, hospital stay, hotel, compression garments"
Istanbul,Turkey,Rhinoplasty,Comfort Zone Surgery,"Göktürk Merkez Mahallesi İstanbul Cd. No:26K D:1, 34075 Eyüpsultan, Istanbul","+90 533 954 70 06",request@comfortzonesurgery.com,https://www.comfortzonesurgery.com,3500,5500,USD,"1,800+ procedures/year, operates at Avrasya Hospital, stays at Vialand Palace Hotel",,,,1800+,"English, Turkish, Arabic, Russian","Surgery, hospital stay, hotel, airport transfers, post-op care"
Istanbul,Turkey,Rhinoplasty,Comfort Zone Surgery,"Göktürk Merkez Mahallesi İstanbul Cd. No:26K, D:1, 34075 Eyüpsultan/İstanbul","+90 212 909 8500",info@comfortzonesurgery.com,https://www.comfortzonesurgery.com,3500,5500,USD,"All-inclusive packages, 15 min from Istanbul Airport, luxury hotel included","Turkish Ministry of Health, JCI Partner Hospital",2018,1200+,97%,"English, Turkish, Arabic, Russian, German","Surgery, hotel, airport transfers, post-op care, lifetime support"
Istanbul,Turkey,Rhinoplasty,Estethica Surgery,"Atasehir, Istanbul","+90 216 570 00 00",info@estethica.com.tr,https://www.estethica.com.tr,3200,5200,USD,"Turkey's largest aesthetic chain, ultrasonic & traditional rhinoplasty","ISO 9001",2004,15000+,,"English, Turkish, Arabic, Russian","Surgery, hospital stay, hotel, transfers, post-op care"
Istanbul,Turkey,Rhinoplasty,Memorial Bahcelievler Hospital,"Bahcelievler, Istanbul","+90 212 314 66 66",info@memorial.com.tr,https://www.memorial.com.tr,3500,5500,USD,"JCI-accredited, experienced ENT & plastic surgeons",JCI,2014,1000+,,"English, Turkish, Arabic","Surgery, 1-night hospital stay, hotel, medications"
Istanbul,Turkey,Tummy Tuck,Comfort Zone Surgery,"Göktürk Merkez Mahallesi İstanbul Cd. No:26K, D:1, 34075 Eyüpsultan/İstanbul","+90 212 909 8500",info@comfortzonesurgery.com,https://www.comfortzonesurgery.com,3800,5500,USD,"Advanced techniques, luxury recovery hotel","Turkish Ministry of Health, JCI Partner Hospital",2018,600+,95%,"English, Turkish, Arabic, Russian, German","Abdominoplasty, hotel, airport service, post-op garment, follow-up"
Istanbul,Turkey,Tummy Tuck,Estethica Surgery,"Atasehir, Istanbul","+90 216 570 00 00",info@estethica.com.tr,https://www.estethica.com.tr,3500,5500,USD,"Turkey's largest aesthetic chain, abdominoplasty specialists","ISO 9001",2004,15000+,,"English, Turkish, Arabic, Russian","Surgery, hospital stay, hotel, garments, transfers"
Istanbul,Turkey,Tummy Tuck,Memorial Sisli Hospital,"Sisli, Istanbul","+90 212 314 66 66",info@memorial.com.tr,https://www.memorial.com.tr,3800,6000,USD,"JCI-accredited, experienced plastic surgeons, modern techniques",JCI,1995,1800+,,"English, Turkish, Arabic","Surgery, 1-2 night hospital stay, hotel, garments"
Kuala Lumpur,Malaysia,Colonoscopy,Prince Court Medical Centre,"Kuala Lumpur, Malaysia","+60 3 2160 0000",info@princecourt.com,https://www.princecourt.com,600,1000,USD,"Premium private hospital, JCI-accredited, advanced GI services","JCI, MSQH",2007,,,"English, Malay, Chinese","Procedure, sedation, consultation, detailed report"
